{
    "version": "1.0.0",
    "testName": "TestJSON",
    "timeStamp": "1653051619",
    "testType": {
        "excitation": {
            "type": "sineSwept",
            "outputLevel": 0.4,
            "parameters": {
                "frequency": {
                    "min": 3.0,
                    "max": 30.0,
                    "units": "Hz"
                },
                "sweep": {
                    "direction": "up",
                    "rate": 0.1,
                    "rateUnits": "Hz/s",
                    "type": "linear"
                }
            }
        },
        "amplification": {
            "value": 50.0,
            "units": "percentage"
        },
        "bandwidth": {
            "value": 30.0,
            "units": "Hz"
        },
        "spectralLines": 512,
        "averages": 3,
        "control": "openLoop",
        "repetition": 2,
        "testingNotes": "Testing Notes from Experimentalist",
        "additonalMass": [
            {
                "value": 1.2,
                "units": "Kg",
                "location": {
                    "X": 0,
                    "Y": 2.3,
                    "Z": 1.8,
                    "units": "m"
                }
            },
            {
                "value": 0.5,
                "units": "Kg",
                "location": {
                    "X": 0.6,
                    "Y": 1.3,
                    "Z": 6.8,
                    "units": "m"
                }
            }
        ]
    },
    "sensorData": [
        {
            "name": "Sensor1",
            "model": "352C04",
            "assetNumber": "56C123",
            "manufacturer": "PCB",
            "calibration": {
                "gain": 10.0,
                "units": "mV/g",
                "date": "8 June 2012"
            },
            "location": {
                "X": 1.9,
                "Y": 1.1,
                "Z": -1.8,
                "units": "m"
            }
        },
        {
            "name": "Sensor2",
            "model": "352C04",
            "assetNumber": "56C098",
            "manufacturer": "PCB",
            "calibration": {
                "gain": 10.0,
                "units": "mV/g",
                "date": "8 June 2012"
            },
            "location": {
                "X": 1.1,
                "Y": 1.1,
                "Z": 1.8,
                "units": "m"
            }
        },
        {
            "name": "Force1",
            "model": "1204-12A",
            "assetNumber": "12B893",
            "manufacturer": "PCB",
            "calibration": {
                "gain": 4.0,
                "units": "mV/N",
                "date": "8 June 2012"
            },
            "location": {
                "X": 0,
                "Y": 0,
                "Z": 0,
                "units": "m"
            }
        }
    ]
}